{
  "active_recommendation_state": {
    "acknowledgement_required": false,
    "primary_call": "on_plan",
    "reason_codes": [],
    "secondary_call": null,
    "status": "advisory"
  },
  "assumption_ids": [
    "assumption-f1-dry"
  ],
  "baseline_strategy_revision": "baseline-r1",
  "calculated_at_utc": "2026-07-26T18:00:00Z",
  "capture_time_monotonic_ms": 1080000,
  "capture_time_utc": "2026-07-26T18:00:00Z",
  "car_id": "car-avm-demo",
  "comparison_to_plan": {
    "current_reserve_l": 1.2,
    "strategy_alignment": "on_plan",
    "target_pace_s_per_lap": 494.22,
    "target_stint_end_lap": 26
  },
  "confidence": {
    "overall_band": "high",
    "overall_score": 0.92
  },
  "derived_current_state": {
    "current_stint_distance_m": 11860.0,
    "distance_to_pit_entry_m": 2120.0,
    "estimated_time_to_pit_entry_s": 162.0,
    "fuel_delta_to_plan_l": 1.2,
    "fuel_laps_remaining": 6.4,
    "fuel_use_per_km_l": 0.74,
    "fuel_use_per_lap_l": 2.38,
    "fuel_use_per_minute_l": 0.54,
    "pace_delta_to_target_s_per_lap": 0.18,
    "rolling_valid_pace_s_per_lap": 494.4,
    "stint_progress_ratio": 0.72,
    "track_condition_trend": "stable",
    "traffic_adjusted_pace_s_per_lap": 494.4,
    "tyre_degradation_rate_percent_per_lap": 0.8,
    "weather_trend": "stable"
  },
  "driver_id": "driver-demo",
  "explanation_ids": [
    "explanation-f1-fuel-001"
  ],
  "forecast_snapshot_id": "forecast-f1-normal-001",
  "freshness": {
    "age_ms": 120,
    "state": "live",
    "valid_until_utc": "2026-07-26T18:00:05Z"
  },
  "layout_id": "layout-f1-demo",
  "measured_telemetry_summary": {
    "ambient_temperature_c": 24.0,
    "current_fuel_l": 18.7,
    "current_lap_time_s": 494.231,
    "lap_distance_m": 1640.0,
    "lap_number": 18,
    "normalized_track_position": 0.52,
    "pit_state": "on_track",
    "rain_intensity_0_to_1": 0.0,
    "road_temperature_c": 31.0,
    "speed_mps": 48.2,
    "standing_water_0_to_1": 0.0,
    "track_wetness_0_to_1": 0.0,
    "traffic_state": "clear",
    "weather_measurement_id": "measurement-f1-dry-001"
  },
  "model": {
    "model_family": "f1-mock-race-state",
    "model_version": "0.1.0",
    "producer_component": "driver_bridge"
  },
  "reason_codes": [],
  "sample_set": {
    "excluded_sample_count": 0,
    "newest_sample_utc": "2026-07-26T18:00:00Z",
    "oldest_sample_utc": "2026-07-26T17:58:00Z",
    "operating_regime": "normal_green_running",
    "sample_count": 12,
    "sample_set_id": "samples-f1-qualifying-02"
  },
  "schema_version": "0.1.0",
  "sequence": {
    "sequence_number": 18,
    "stream_id": "calculated-race-f1"
  },
  "session_id": "session-f1-demo",
  "state_id": "state-f1-normal-001",
  "stint_id": "stint-f1-02",
  "strategy_id": "strategy-f1-demo",
  "strategy_revision": "accepted-r3",
  "telemetry_refs": [
    "telemetry-f1-001"
  ],
  "track_id": "track-f1-demo"
}
